{
  "budget_authority": {
    "budget_intent": {
      "mode": "STANDARD",
      "operator_goal": "Bounded integration demo"
    },
    "feasibility": {
      "constraint_note": "No known constraint.",
      "status": "FEASIBLE",
      "unfunded_obligations": []
    },
    "source_budget_id": "BE-PACKAGE-C-001",
    "source_budget_sha256": "c49c50ab27cf3c2d41349ef024aefa089dd2857e719c028828bfebcc423ceb04",
    "total_envelope": {
      "model_tokens": {
        "hard_ceiling_tokens": 8000,
        "target_tokens": 4000
      },
      "wall_clock": {
        "hard_ceiling_minutes": 20,
        "target_minutes": 10
      }
    }
  },
  "consumer_requirement_id": "MR-CQC-5ae322d48d72",
  "evidence_obligation": {
    "evidence_need": "Source-grounded comparative mechanism evidence.",
    "source_requirements": [
      "scholarly source",
      "citable result span"
    ],
    "stopping_condition": "Stop after the obligation is grounded or remains explicitly unresolved.",
    "uncertainty_binding": "Preserve uncertainty about mechanism level and adjacent transfer."
  },
  "question_bindings": [
    {
      "admission_status_note": "CQS v0.1 has no explicit admission-status field; membership is preserved without inventing one.",
      "dependencies": [],
      "question_type": "mechanism",
      "resolution_condition": "A source-grounded result identifies the operative mechanism.",
      "source_admission_status": null,
      "source_question_id": "CQ-01",
      "statement": "What evidence establishes the primary mechanism?",
      "uncertainty": "The relevant level of mechanism remains open."
    },
    {
      "admission_status_note": "CQS v0.1 has no explicit admission-status field; membership is preserved without inventing one.",
      "dependencies": [
        "CQ-01"
      ],
      "question_type": "boundary",
      "resolution_condition": "Independent adjacent evidence supports or narrows the conclusion.",
      "source_admission_status": null,
      "source_question_id": "CQ-02",
      "statement": "Does an adjacent evidence source alter the conclusion?",
      "uncertainty": null
    }
  ],
  "route_authorizations": [
    {
      "activation_condition": "Always execute within the authorized envelope.",
      "allocation_id": "AL01",
      "budget_activation": "COMMITTED",
      "execution_authorization": "ACTIVE_AUTHORIZED",
      "model_token_target": 3000,
      "purpose": "Establish the primary mechanism from result evidence.",
      "source_route_id": "mechanism_core",
      "srp_status": "REQUIRED",
      "unfunded_reason": null,
      "wall_clock_target_minutes": 8
    },
    {
      "activation_condition": "Activate only after an explicit collision or unresolved boundary.",
      "allocation_id": "AL02",
      "budget_activation": "RESERVE_CONDITIONAL",
      "execution_authorization": "HELD_CONDITIONAL",
      "model_token_target": 1000,
      "purpose": "Test whether adjacent evidence changes the conclusion.",
      "source_route_id": "adjacent_check",
      "srp_status": "CONDITIONAL",
      "unfunded_reason": null,
      "wall_clock_target_minutes": 2
    }
  ],
  "schema_version": "mafs-skill-1.1-cqc-requirement.v1",
  "shared_requirement": true,
  "source_lineage": {
    "source_budget_id": "BE-PACKAGE-C-001",
    "source_budget_sha256": "c49c50ab27cf3c2d41349ef024aefa089dd2857e719c028828bfebcc423ceb04",
    "source_cqs_id": "CQS-PACKAGE-C-001",
    "source_cqs_sha256": "991ac69049a811245974ebbf506e133d1e49d428502397ba822a799fb2b2695f",
    "source_integration_binding_id": "BIND-PACKAGE-C-001",
    "source_integration_binding_sha256": "293d891b20cee8c380cfb83fd50a62bbe39c64145db6d8f11b6064e5ec72aec2",
    "source_srp_id": "SRP-PACKAGE-C-001",
    "source_srp_sha256": "8b87538ebf027d9a5f91d1dbe691feb7250d210829cb020298675a186d6e6df6"
  },
  "source_requirement_id": "R01",
  "source_srp_id": "SRP-PACKAGE-C-001",
  "source_srp_sha256": "8b87538ebf027d9a5f91d1dbe691feb7250d210829cb020298675a186d6e6df6",
  "target_question_ids": [
    "CQ-01",
    "CQ-02"
  ]
}
